{
  "protocol_version": "codeattest.v0",
  "review_id": "review:synthetic-demo-001",
  "classification_record_id": "classification_record:synthetic_likely_001",
  "review_finding_draft_ref": "review_finding_draft:demo_finding_context",
  "classification": "likely",
  "classified_at": "2026-07-22T00:00:00Z",
  "actor": {
    "actor_type": "reviewer",
    "actor_id": "reviewer:synthetic-amelia"
  },
  "evidence_basis": [
    "scanner_output",
    "finding_context_snippet",
    "retained_review_artifact"
  ],
  "confirmation_criteria": [],
  "threshold_gaps": [
    "SYNTHETIC_DEMO_DATA bounded snippet context needs broader review before confirmation. NOT_CUSTOMER_SOURCE."
  ],
  "limitations": [
    "SYNTHETIC_DEMO_DATA classification keeps scanner provenance separate from expert judgment. NOT_CUSTOMER_SOURCE."
  ],
  "rationale": "SYNTHETIC_DEMO_DATA reviewer records a likely finding pending broader context. NOT_CUSTOMER_SOURCE.",
  "source_reference_state": "retained_review_artifact",
  "source_derived_class": "retained_review_artifact",
  "visibility": "customer_facing",
  "review_finding_draft_evidence_refs": [
    {
      "artifact_ref": "artifact_ref:scanner_finding_set",
      "availability_state": "retained_review_artifact",
      "available_for_review": true,
      "display_state": "available_reference",
      "source_derived_class": "retained_review_artifact"
    },
    {
      "artifact_ref": "artifact_ref:synthetic_raw_snippet",
      "availability_state": "retained_review_artifact",
      "available_for_review": true,
      "display_state": "available_reference",
      "source_derived_class": "transient_source_derived"
    }
  ]
}
